{
  "schemaVersion": "1.0.0",
  "frameworkId": "ncom",
  "sourceCommit": "a350b576bbeae6c6254273037a17d2a8730fb80f",
  "catalogRootHash": "sha256:0dbfa378eedaaef0b31867b679e7932157eb63bb0cc4e3fa0fb0a0d1869c6518",
  "symbolRootHash": "sha256:52e4461d185ce375263aca5e412b2d93f402d906867bf0940bffc9807eec6297",
  "generatedAt": "2026-07-28T03:27:49.438Z",
  "candidates": [
    {
      "id": "family-base-ncomponent-81565f5c",
      "structuralSignal": "base:NComponent",
      "proposedName": "NComponent structural family",
      "componentIds": [
        "component-078563e274bd74a1",
        "component-09c7b8e4e89a5ecd",
        "component-0bbbfda64ac8f3b0",
        "component-1211c985a80a45a7",
        "component-1cc29c62f560e54e",
        "component-3cbb829be47ac290",
        "component-4311e7da3e44f9af",
        "component-4b9e9229e841370f",
        "component-5569bcc4a06f7f4b",
        "component-59e4204498fb6bcd",
        "component-6279f9bfe1af1227",
        "component-67803aa18e4c7439",
        "component-6e6b9f678416815b",
        "component-6f0816f819325665",
        "component-7f73d7fa16d35de4",
        "component-87a3d1af2276c69f",
        "component-8945793b5db3b667",
        "component-8c1ef37a621188d9",
        "component-8ccdaa5f7832eb45",
        "component-9c18762714c09034",
        "component-9e35ff4c0d6a10f7",
        "component-a0d4c93ecb479f12",
        "component-a8a82141f9b2d6ff",
        "component-a8e56b3c514601b8",
        "component-b0714fa03081d56f",
        "component-baf8eef39d4e3bee",
        "component-bda4be073762fd47",
        "component-c2db5ccb52857601",
        "component-c91f200eac7580c2",
        "component-ca4adceb9e70c54d",
        "component-cc0c6107ce50a14d",
        "component-d61ac725a2d438d4",
        "component-d955af7be8075ee6",
        "component-df5a34475981652d",
        "component-dfbeb8641165a603",
        "component-ea5dc8d798d1d252",
        "component-ef4ae138733907d4",
        "component-ef6fa2ad8e7750e7",
        "component-f58fc0fa34333b7b",
        "component-fa43e7d214230283",
        "component-fa59b198eb92db14"
      ],
      "componentNames": [
        "NCAlert",
        "NCBadge",
        "NCBaseInput",
        "NCBreadcrumb",
        "NCButton",
        "NCCalendar",
        "NCCard",
        "NCCarousel",
        "NCCol",
        "NCCollapse",
        "NCComplextTable",
        "NCDivider",
        "NCDrawer",
        "NCEmpty",
        "NCForm",
        "NCFormItem",
        "NCLayout",
        "NCLoading",
        "NCMenu",
        "NCMessage",
        "NCModal",
        "NCPagination",
        "NCPopconfirm",
        "NCPopmenu",
        "NCPopover",
        "NCProgress",
        "NCRoute",
        "NCRouter",
        "NCRow",
        "NCSkeleton",
        "NCSplitPanel",
        "NCStatistic",
        "NCSteps",
        "NCTable",
        "NCTabs",
        "NCTag",
        "NCTimeline",
        "NCTooltip",
        "NCTour",
        "NCWaterfall",
        "NCWatermark"
      ],
      "representativeComponents": [
        "NCAlert",
        "NCBadge",
        "NCBaseInput"
      ],
      "sharedBaseTypes": [
        "NComponent"
      ],
      "sharedInterfaces": [],
      "sharedEvents": [],
      "sharedMethods": [],
      "sharedProperties": [],
      "sharedStylePatterns": [],
      "publicPackages": [
        "@ncom/all",
        "@ncom/components"
      ],
      "evidence": [
        {
          "componentId": "component-078563e274bd74a1",
          "path": "packages/components/src/alert/index.ts",
          "line": 13,
          "sha256": "11a6fc230fa24a22d47bb7d4c59da203e699afd5be00146f98d6f7f6fc676857"
        },
        {
          "componentId": "component-fa59b198eb92db14",
          "path": "packages/components/src/badge/index.ts",
          "line": 6,
          "sha256": "22a4cd9de974191be0eae50ee2d13dafcc49cf1ad2b559f27d41b535c468095a"
        },
        {
          "componentId": "component-a8a82141f9b2d6ff",
          "path": "packages/components/src/form/baseinput.ts",
          "line": 7,
          "sha256": "01d9576e5f3976e060d7b12e6ed6b87f182f6474f79785d61e2f9e3002088d89"
        },
        {
          "componentId": "component-d955af7be8075ee6",
          "path": "packages/components/src/breadcrumb/index.ts",
          "line": 13,
          "sha256": "f9523e57f9d323edddef6d2fdf04073dd17a8f77f8502220930751a6197d945e"
        },
        {
          "componentId": "component-6279f9bfe1af1227",
          "path": "packages/components/src/button/index.ts",
          "line": 9,
          "sha256": "3817dfdeb01a4b929991d66eb1f1217903b0a27df346587afeaa15a178daa401"
        },
        {
          "componentId": "component-1cc29c62f560e54e",
          "path": "packages/components/src/calendar/index.ts",
          "line": 43,
          "sha256": "6adac850c64fc61d9cb009789d216012fc816c1639978c63d6a1f68cb34b4836"
        },
        {
          "componentId": "component-8945793b5db3b667",
          "path": "packages/components/src/card/index.ts",
          "line": 25,
          "sha256": "37cd9d9ede0cc520809dc0c85fe76ba5c3e63e8d53a1cd9cbc1de4c56005dd69"
        },
        {
          "componentId": "component-c91f200eac7580c2",
          "path": "packages/components/src/carousel/index.ts",
          "line": 6,
          "sha256": "ed0438ec0f3c3a5cb44bd6428a19f40d1fb9f9f68795c27592b5a5d369d7d48f"
        },
        {
          "componentId": "component-fa43e7d214230283",
          "path": "packages/components/src/grid/col.ts",
          "line": 5,
          "sha256": "8d8562c6feed33b733bd7af1c76e0ff3c929ed981b9aef2980cc8161a5eff217"
        },
        {
          "componentId": "component-c2db5ccb52857601",
          "path": "packages/components/src/collapse/index.ts",
          "line": 13,
          "sha256": "07fbd941a048550dbd11768bf88051a78e9f859171ac8e5ba50ea083308e5e20"
        },
        {
          "componentId": "component-67803aa18e4c7439",
          "path": "packages/components/src/complexttable/index.ts",
          "line": 39,
          "sha256": "bd1956fee692259392e9fb1d50e9931256e6f4566e2b4e1215e83f385e408535"
        },
        {
          "componentId": "component-4b9e9229e841370f",
          "path": "packages/components/src/divider/index.ts",
          "line": 13,
          "sha256": "b6b3c2e56265d6faeaeae84902bb5d03c694e2fff7ea7425e7b53ec8d79e53a9"
        },
        {
          "componentId": "component-59e4204498fb6bcd",
          "path": "packages/components/src/drawer/index.ts",
          "line": 7,
          "sha256": "d68a73bcd4262952a6789e72dd8ec484c3d27c99c36a2792ce23246f44b9c4c5"
        },
        {
          "componentId": "component-a8e56b3c514601b8",
          "path": "packages/components/src/empty/index.ts",
          "line": 8,
          "sha256": "8bb5d77ee2ef3e515a6b07fa6cdb7001ff1a2a56b982d89017138c0622ff5585"
        },
        {
          "componentId": "component-8ccdaa5f7832eb45",
          "path": "packages/components/src/form/form.ts",
          "line": 17,
          "sha256": "73e2e793af40bff484b76f34ce12026daf215f1e42efc9ed86132b8a461f9309"
        },
        {
          "componentId": "component-dfbeb8641165a603",
          "path": "packages/components/src/form/formitem.ts",
          "line": 22,
          "sha256": "135729d3ef2460ba47784826bf19e09ec016bdb23f3687bdbed57a2b7a0b9511"
        },
        {
          "componentId": "component-09c7b8e4e89a5ecd",
          "path": "packages/components/src/layout/index.ts",
          "line": 33,
          "sha256": "74c03ac246a5907909e1165fed918ed07f2992c2e35c65aab7864e293254151d"
        },
        {
          "componentId": "component-4311e7da3e44f9af",
          "path": "packages/components/src/loading/index.ts",
          "line": 8,
          "sha256": "052f857e44e767af25e00ed6927a884189cbc2cd89ef6c4a1a34025b9e8e24c2"
        },
        {
          "componentId": "component-f58fc0fa34333b7b",
          "path": "packages/components/src/menu/index.ts",
          "line": 6,
          "sha256": "c37bc428425a1edcb70e4543eb493755d761cab69bbdc895a3a8fea2ca378330"
        },
        {
          "componentId": "component-ef4ae138733907d4",
          "path": "packages/components/src/message/index.ts",
          "line": 8,
          "sha256": "1693eb9da91d921f8b247a21839c34569809b67e71031918dd7d24e58d81d7b6"
        },
        {
          "componentId": "component-ea5dc8d798d1d252",
          "path": "packages/components/src/modal/index.ts",
          "line": 6,
          "sha256": "8b2bc0f49a2eb04013bf63e750652677077c935ac243fb714f396b254f3d943a"
        },
        {
          "componentId": "component-5569bcc4a06f7f4b",
          "path": "packages/components/src/pagination/index.ts",
          "line": 61,
          "sha256": "59be4b2c6a8ea11b33a808f3c9fb6a820f8f938079669a643e37ace67460acad"
        },
        {
          "componentId": "component-9e35ff4c0d6a10f7",
          "path": "packages/components/src/popconfirm/index.ts",
          "line": 11,
          "sha256": "91534aefbaec47d3e9f49983664e8b62a23c4c88dc39baa4901ba06ace4fcfc9"
        },
        {
          "componentId": "component-baf8eef39d4e3bee",
          "path": "packages/components/src/popmenu/index.ts",
          "line": 41,
          "sha256": "c1d3870ac0f834a702c2b1d584c4231e63e20b9ad3c2fee97594133adc47246b"
        },
        {
          "componentId": "component-1211c985a80a45a7",
          "path": "packages/components/src/popover/index.ts",
          "line": 5,
          "sha256": "087686f36f1df42d123ba73c542c551d8923d91bffc1e8bbb9a079f90b0b10a9"
        },
        {
          "componentId": "component-87a3d1af2276c69f",
          "path": "packages/components/src/progress/index.ts",
          "line": 13,
          "sha256": "38518642c991a8f9f7c733df2092acd2b03964cc72324e5a87559336635a5bf1"
        },
        {
          "componentId": "component-bda4be073762fd47",
          "path": "packages/components/src/router/ncroute.ts",
          "line": 4,